{
  "schema_version": "1.0.0",
  "document_id": "18216-05",
  "retrieval_cutoff": "2026-08-07T13:00:00Z",
  "scrape_run_id": "cf331fe233744d5590210db0e38a8f43",
  "capture_count": 23,
  "gap_count": 10,
  "items": [
    {
      "id": "dipres-financial-report",
      "publisher": "Dirección de Presupuestos",
      "kind": "official_record",
      "perspective": "primary_document",
      "published_at": "2026-04-22T00:00:00Z",
      "url": "https://www.dipres.gob.cl/604/w3-article-409825.html",
      "title": "084-2026 - DIPRES Informes Financieros",
      "summary": "084-2026 Proyecto de ley para la Reconstrucción Nacional y el desarrollo económico y social Proyecto de ley para la Reconstrucción Nacional y el desarrollo económico y social",
      "snapshot_id": "b0739e323b4943fb8587ab78b6c61171",
      "screenshot": "megareforma/screenshots/dipres-financial-report.jpg",
      "screenshot_sha256": "2f0f8e2fb63f3aff22cad85c67d3244a1c491b29f050dc75607e2e1245912f13",
      "captured_at": "2026-08-07T13:29:43.488018Z",
      "original_url": "https://www.dipres.gob.cl/604/w3-article-409825.html",
      "new_observation": false
    },
    {
      "id": "chamber-reports",
      "publisher": "Cámara de Diputadas y Diputados",
      "kind": "official_record",
      "perspective": "legislative_record",
      "published_at": "2026-07-22T00:00:00Z",
      "url": "https://www.camara.cl/legislacion/proyectosdeley/informes.aspx?prmBOLETIN=18216-05&prmID=18872",
      "title": "Honorable Cámara de Diputadas y Diputados",
      "summary": "Sitio oficial de la Honorable Cámara de Diputados de Chile, organismo encargado por la Constitución Política de la elaboración de las leyes en conjunto con el Gobierno y el Senado",
      "snapshot_id": "7163c0b0ba9f440eb008a23962e4ea70",
      "screenshot": "megareforma/screenshots/chamber-reports.jpg",
      "screenshot_sha256": "9a638c548ee760122e3e998f76931e9f757c1b5cd2e178d7be2bf0b732f8be19",
      "captured_at": "2026-08-07T13:31:17.358128Z",
      "original_url": "https://www.camara.cl/legislacion/proyectosdeley/informes.aspx?prmBOLETIN=18216-05&prmID=18872",
      "new_observation": false
    },
    {
      "id": "senate-particular-vote",
      "publisher": "Senado de la República",
      "kind": "official_record",
      "perspective": "legislative_record",
      "published_at": "2026-07-15T00:00:00Z",
      "url": "https://www.senado.cl/comunicaciones/noticias/senado-comienza-votacion-en-particular-del-proyecto-de-reconstruccion",
      "title": "Senado comienza votación en particular del proyecto de reconstrucción | Senado República de Chile",
      "summary": "Fuente relevante para el expediente de la Megareforma.",
      "snapshot_id": "d1262a8011e54ee4961b44f6a93eef95",
      "screenshot": "megareforma/screenshots/senate-particular-vote.jpg",
      "screenshot_sha256": "17693c3989618b527aeb469f05491c16c6c467103b069cc043125e92e7f0e7a8",
      "captured_at": "2026-08-07T13:31:27.373094Z",
      "original_url": "https://www.senado.cl/comunicaciones/noticias/senado-comienza-votacion-en-particular-del-proyecto-de-reconstruccion",
      "new_observation": false
    },
    {
      "id": "senate-session-43",
      "publisher": "Senado de la República",
      "kind": "official_record",
      "perspective": "legislative_record",
      "published_at": "2026-07-15T00:00:00Z",
      "url": "https://www.senado.cl/actividad-legislativa/sala-de-sesiones/sesiones-de-sala/10227",
      "title": "Sesión de sala N°43 | Senado República de Chile",
      "summary": "Fuente relevante para el expediente de la Megareforma.",
      "snapshot_id": "d5c664f1ff6442c1b1272f4d7a6f6eb5",
      "screenshot": "megareforma/screenshots/senate-session-43.jpg",
      "screenshot_sha256": "59c298a971b6d1826b898a69a52ba70607892b346f0a4ac5004c2f8fb09c4e81",
      "captured_at": "2026-08-07T13:31:37.549530Z",
      "original_url": "https://www.senado.cl/actividad-legislativa/sala-de-sesiones/sesiones-de-sala/10227",
      "new_observation": false
    },
    {
      "id": "cfa-comments",
      "publisher": "Consejo Fiscal Autónomo",
      "kind": "official_record",
      "perspective": "fiscal_analysis",
      "published_at": "2026-05-05T00:00:00Z",
      "url": "https://cdn.hacienda.cl/asset/cfa/attachment/de6f734132638b8bc9523ab6890053631d093087738eb92029e609cbd927935a/1780086443",
      "title": "Identifíquese « CDN 2",
      "summary": "Fuente relevante para el expediente de la Megareforma.",
      "snapshot_id": "d052f658b903460c9cd7a79da79c36e4",
      "screenshot": "megareforma/screenshots/cfa-comments.jpg",
      "screenshot_sha256": "80685d2d45d9e0407f841ad6dda7465c04f96b04cb145f9e1b518a95928e15b2",
      "captured_at": "2026-08-07T13:31:51.562306Z",
      "original_url": "https://cdn.hacienda.cl/asset/cfa/attachment/de6f734132638b8bc9523ab6890053631d093087738eb92029e609cbd927935a/1780086443",
      "new_observation": false
    },
    {
      "id": "biobio-opposition-23-doubts",
      "publisher": "BioBioChile",
      "kind": "news",
      "perspective": "opposition_claims",
      "published_at": "2026-05-05T15:00:00Z",
      "url": "https://www.biobiochile.cl/noticias/economia/actualidad-economica/2026/05/05/las-23-dudas-de-las-oposiciones-ante-la-ley-de-reconstruccion-senalan-inconsistencias-en-las-cifras.shtml",
      "title": "Las 23 dudas de las oposiciones ante la Ley de Reconstrucción: señalan inconsistencias en las cifras",
      "summary": "La “Ley de Reconstrucción Nacional” viene a ser la especie de “Ley Ómnibus” del presidente José Antonio Kast, con un...",
      "snapshot_id": "ca7c3c1222a54900b7becfddc4c8bcf4",
      "screenshot": "megareforma/screenshots/biobio-opposition-23-doubts.jpg",
      "screenshot_sha256": "d82374f767d048ad1d9ba0eb82fd3259ccb348d9fce79dcb7f68689f0afeb39c",
      "captured_at": "2026-08-07T13:32:04.448792Z",
      "original_url": "https://www.biobiochile.cl/noticias/economia/actualidad-economica/2026/05/05/las-23-dudas-de-las-oposiciones-ante-la-ley-de-reconstruccion-senalan-inconsistencias-en-las-cifras.shtml",
      "new_observation": false
    },
    {
      "id": "biobio-parisi-negotiation",
      "publisher": "BioBioChile",
      "kind": "news",
      "perspective": "negotiation",
      "published_at": "2026-05-07T12:02:00Z",
      "url": "https://www.biobiochile.cl/noticias/nacional/chile/2026/05/07/megarreforma-parisi-habla-de-acuerdos-con-quiroz-pero-deja-definicion-final-en-manos-de-diputados.shtml",
      "title": "Megarreforma: Parisi asegura que hay acuerdos con Quiroz, pero deja decisión final a bancada del PDG",
      "summary": "En medio de la tensión política generada tras el quiebre entre el Gobierno y el Partido de la Gente (PDG),...",
      "snapshot_id": "164d2b72219a40d5b5e14701826f5e88",
      "screenshot": "megareforma/screenshots/biobio-parisi-negotiation.jpg",
      "screenshot_sha256": "a5abdc5f6b6fd6ea235d144bace7776eb00a32e7ac73d8501ac66428e229f956",
      "captured_at": "2026-08-07T13:32:13.202411Z",
      "original_url": "https://www.biobiochile.cl/noticias/nacional/chile/2026/05/07/megarreforma-parisi-habla-de-acuerdos-con-quiroz-pero-deja-definicion-final-en-manos-de-diputados.shtml",
      "new_observation": false
    },
    {
      "id": "biobio-quiroz-adjustments",
      "publisher": "BioBioChile",
      "kind": "news",
      "perspective": "government",
      "published_at": "2026-05-28T11:08:00Z",
      "url": "https://www.biobiochile.cl/noticias/nacional/chile/2026/05/28/quiroz-matiza-idea-de-ajustes-a-megarreforma-tras-informe-de-finanzas-publicas-puede-ser-eso-o-nada.shtml",
      "title": "Quiroz matiza idea de ajustes a megarreforma tras informe de finanzas públicas: \"Puede ser eso o nada\"",
      "summary": "El ministro de Hacienda, Jorge Quiroz, abordó las posibles modificaciones que tendría que hacer el gobierno al proyecto de Reconstrucción,...",
      "snapshot_id": "455e86ba105f4a1ab7123ff3d655e671",
      "screenshot": "megareforma/screenshots/biobio-quiroz-adjustments.jpg",
      "screenshot_sha256": "8bd22e3bdbda5936e320bc34d7cf4aa375fdb13480a9477861946f9f828638db",
      "captured_at": "2026-08-07T13:32:20.585574Z",
      "original_url": "https://www.biobiochile.cl/noticias/nacional/chile/2026/05/28/quiroz-matiza-idea-de-ajustes-a-megarreforma-tras-informe-de-finanzas-publicas-puede-ser-eso-o-nada.shtml",
      "new_observation": false
    },
    {
      "id": "biobio-senate-advance",
      "publisher": "BioBioChile",
      "kind": "news",
      "perspective": "government",
      "published_at": "2026-07-16T03:08:00Z",
      "url": "https://www.biobiochile.cl/noticias/nacional/chile/2026/07/16/ministro-quiroz-y-presidenta-del-senado-celebran-avance-de-megarreforma-y-destacan-impacto-en-empleo.shtml",
      "title": "Ministro Quiroz y presidenta del Senado celebran avance de megarreforma y destacan impacto en empleo",
      "summary": "Tras la maratónica votación en el Senado, el ministro de Hacienda, Jorge Quiroz, calificó como un día importante para Chile...",
      "snapshot_id": "beb7171be94e4f19ae545b671290c0da",
      "screenshot": "megareforma/screenshots/biobio-senate-advance.jpg",
      "screenshot_sha256": "50a7104fb7eeb6c107dec6f20ad8708caad0f47bc5ff5202a2788ea46b23b454",
      "captured_at": "2026-08-07T13:32:27.621471Z",
      "original_url": "https://www.biobiochile.cl/noticias/nacional/chile/2026/07/16/ministro-quiroz-y-presidenta-del-senado-celebran-avance-de-megarreforma-y-destacan-impacto-en-empleo.shtml",
      "new_observation": false
    },
    {
      "id": "latercera-yeomans-dialogue",
      "publisher": "La Tercera",
      "kind": "news",
      "perspective": "opposition_claims",
      "published_at": "2026-05-03T00:00:00Z",
      "url": "https://www.latercera.com/politica/noticia/diputada-gael-yeomans-fa-podemos-ser-una-oposicion-firme-y-que-a-la-vez-dialogue/",
      "title": "Diputada Gael Yeomans (FA): “Podemos ser una oposición firme y que, a la vez, dialogue” - La Tercera",